Unnamed: 0.1,Unnamed: 0,Text Blocks,Timestamp,Category,Company,Stock
566,566,"Audi plans to cut 9,500 jobs in 6 years",2019-11-27,public_relations,ev_all,EV
567,567,"The function of the Tesla driving recorder is amazingly assisted, and the Qingpu Branch of the Shanghai Municipal Public Security Bureau cracked a series of cross-provincial high-speed ceramic fraud cases. little medal to wear",2019-11-27,user_experience,ev_all,EV
568,568,"British couple have won a £105 million jackpot in the EuroMillions lottery. November 26 Winner Steve reveals wishes for three children. The older son wants his own room, the younger son wants a Tesla, and the daughter wants an iPhone.",2019-11-28,user_experience,ev_all,EV
569,569,Tesla pickup or join Dubai's toughest police fleet,2019-11-29,user_experience,ev_all,EV
570,570,It is planning a big push into the Indian market and will launch a compact SUV based on the SP concept in the second half of 2019. The Kia SP Concept made its debut at the Auto Expo 2018 in the Greater Noida area.,2019-11-30,sales_marketing,ev_all,EV
571,571,"Kia Motors is reportedly planning a big push into the Indian market. Kia Motors is developing an electric car specially made for the Indian market, and important information such as the cruising range preferred by Indian customers has been forwarded to Kia's Korean headquarters. If all goes according to plan, it will be Kia's first electric car developed exclusively for India and is expected to hit the market as early as 2021.",2019-11-30,sales_marketing,ev_all,EV
572,572,"43 billion will be repaid in one year! BYD issued bonds 16 times during the year, how short of money is it?",2019-11-30,stock,ev_all,EV
573,573,The undisguised test car of the Volkswagen ID was photographed. It can be said that it is a combination of Passat and ID.,2019-12-01,user_experience,ev_all,EV
574,574,"As the world's leading suppLi er of styrene series products, INEOS Styrolution announced that its product Luran S 777K SPF30 BK61066 has been selected by Li  Auto",2019-12-02,sales_marketing,ev_all,EV
575,575,"Mercedes-Benz and Audi cut nearly 20,000 jobs",2019-12-05,public_relations,ev_all,EV
576,576,"Mercedes-Benz and Audi cut nearly 20,000 jobs",2019-12-05,public_relations,ev_all,EV
577,577,"According to the above insurance data, Kia sold 94,345 vehicles in China for the whole year, a year-on-year decrease of 40.48%. New Energy VehiclesNew Energy Vehicles#帮我选车#In fact, not only Kia, but almost all traditional fuel vehicle companies such as Volkswagen, Honda, Toyota, etc. have seen their sales plummet. Where did their share go? Without him, it was snatched away by new energy car companies. Is fuel car companies belatedly aware? Nor is it. One is that they are too big to fall off. Expand the full text c",2019-12-06,competition,ev_all,EV
578,578,"Kia Motors recently announced that it has completed construction of a factory invested in Andhra Pradesh in southeastern India. Covers an area of ​​about 2.2 million square meters. It will be officially put into production in the second half of 2019. The annual production capacity is 300,000 vehicles. It plans to produce compact cars and SUVs, which are popular in India. Kia Motors aims to be among the top five car sales in India by 2021.",2019-12-08,sales_marketing,ev_all,EV
579,579,Tesla charges $10 a month for traffic,2019-12-08,user_experience,ev_all,EV
580,580,NIO lays off workers in North America,2019-12-11,public_relations,ev_all,EV
581,581,Volkswagen loses more than 230 billion due to emission gate,2019-12-11,product,ev_all,EV
582,582,"BYD received a subsidy of 3.63 billion yuan! Ministry of Industry and Information Technology: New energy subsidies exceeded 13.7 billion yuan in 2018. Among them, BYD Auto received 1.98 billion yuan, BYD Auto Industry received 1.65 billion yuan, and BYD Auto Industry Changsha Branch received 1.26 million yuan, a total of 3.63 billion yuan.",2019-12-11,macroeconomics,ev_all,EV
583,583,"The development of electric vehicles is constantly advancing, and every automaker is trying to take the lead in the field of electric vehicles. After all, in this industry, electrification is already in progress, and the German luxury brand BMW is also actively developing this technology.",2019-12-13,technical_innovation,ev_all,EV
584,584,"Apple, Tesla accused of using African child labor",2019-12-17,public_relations,ev_all,EV
585,585,Xiaopeng Motors responds to 47 shareholders pledged equity: it is a normal adjustment,2019-12-17,stock,ev_all,EV
586,586,The new Mercedes-Benz broke down after only driving 30 kilometers,2019-12-18,product,ev_all,EV
587,587,"Comprehensive layout of the SUV market, Mercedes-Benz's new pure electric SUV will be made in China at the end of the year",2019-12-19,sales_marketing,ev_all,EV
588,588,Now you can experience Tesla Atari games through a USB external game controller,2019-12-19,user_experience,ev_all,EV
589,589,Xiaopeng Motors is in the C+ round of financing,2019-12-19,stock,ev_all,EV
590,590,BMW accused of fraudulent sales,2019-12-25,sales_marketing,ev_all,EV
591,591,"At present, consumers have more and more mobile travel and leisure methods, and it is difficult to meet the increasingly diverse travel needs with the car alone. Based on this, Hyundai Kia Motors launched a vehicle built-in Electric scooters are also being considered as an option for users to be equipped with new models that will be launched around 2021 to meet the current changing mobility needs",2019-12-27,product,ev_all,EV
592,592,"NIO responded to ""no money to pay wages"", saying that it was ""adjusting the salary payment time"", and the stock price in 2019 shrank by 75%. At the beginning of the year, NIO ES8 caught fire, causing Li Bin to start a large-scale",2019-12-27,stock,ev_all,EV
593,593,China-made Tesla exempted from vehicle purchase tax,2019-12-27,cost,ev_all,EV
594,594,Tesla Receives Ten Billion Loans from Chinese Banks,2019-12-28,macroeconomics,ev_all,EV
595,595,"Recently, Hyundai Kia Motors has launched a built-in electric scooter, which may be equipped on new models launched around 2021. It is a good idea to solve the ""last mile"" of users, but isn't it always driven directly to the destination in China?​",2019-12-29,product,ev_all,EV
596,596,"The three major external U.S. stock indexes collectively rose, new energy vehicle stocks strengthened, Tesla rose more than 6%, and Xiaopeng Motors rose more than 5%",2019-12-29,stock,ev_all,EV
597,597,"On December 13, 2019, on the 4th, the Li ONE had just deLi vered the first batch of models, and the fault alarm problem caused concern. The first owner was the racer Han Han, and some vehicles had dashboard fault alarms, exhaust system faults, parking system error",2019-12-30,product,ev_all,EV
598,598,"2020 is coming, May Tesla's force be with you!",2019-12-31,public_relations,ev_all,EV
599,599,"Allin has been in the car manufacturing business for two years. He Xiaopeng said frankly that in the past 2019, every day was difficult.",2020-01-01,public_relations,ev_all,EV
600,600,"Recently, He Xiaopeng, chairman of Xiaopeng Motors, said that the mileage anxiety and value preservation problems of electric vehicles will be resolved in 2021. It is very normal to challenge, misunderstand or question new car manufacturers.",2020-01-03,product,ev_all,EV
601,601,"According to Reuters, people famiLi ar with the matter said that Li  Auto had secretly filed an IPO appLi cation in December 2019 to raise at least US$500 milLi on in funds, and the IPO will be carried out in early 2020. People famiLi ar with the matter said that Li  Auto started its IPO plan last summer and hired Goldman Sachs as the underwriting bank to lead the transaction.",2020-01-04,stock,ev_all,EV
602,602,"Mercedes-Benz recalls 750,000 vehicles",2020-01-05,product,ev_all,EV
603,603,"NIO's December delivery data was released, reaching 3,170 units, a month-on-month increase of 25.4%, a new high for the year.",2020-01-06,sales_marketing,ev_all,EV
604,604,"As more and more car companies launch electrification strategies, new electric vehicles have also begun to emerge in an endless stream. A few days ago, Kia Motors is preparing to build a pure electric model, which is expected to be launched in 2021.",2020-01-07,product,ev_all,EV
605,605,China-made Tesla officially delivered,2020-01-08,sales_marketing,ev_all,EV
606,606,"Under the trend of global market retreat in the past two years, Ningde Times has achieved a profit margin far ahead of Samsung and LG when fighting for costs. CATL's 2018 operating profit margin was 14.08%, much higher than the 5.7% and 3.2% of Samsung SDI and LG Chem. Despite such downstream demand, there are only 60 power battery companies in the country in 2019, and this number was 300 in 2016. I don't know whether BYD's super lithium iron phosphate battery can change the existing pattern and increase the existing market share after it is officially put into use.",2020-01-09,sales_marketing,ev_all,EV
607,607," The Ministry of Industry and Information Technology released the accounting expenses for the promotion of new energy vehicles in 2018. BYD received a total of 3.62 billion yuan, accounting for 26.36%",2020-01-10,macroeconomics,ev_all,EV
608,608,"Looking at the global power battery field, Ningde era is a dark horse. In 2017, it not only surpassed BYD, but also took the championship from Panasonic. In 2018, Ningde Times once again ranked first in the world with 23.4GWh, 23% of the global market share, 2 percentage points higher than the second-ranked Panasonic. The Ningde era is not at ease. Compared with foreign companies, there is still a gap between the Ningde era and foreign companies in terms of battery capacity density and battery cost control.​",2020-01-12,competition,ev_all,EV
609,609,"According to the installed capacity of power batteries in China in 2019, Ningde Times, BYD, and Guoxuan Hi-Tech ranked the top three, and Ningde Times' installed power batteries accounted for half of the country, an increase of 9.86% compared with 2018.​",2020-01-13,competition,ev_all,EV
610,610,Xiaopeng Automobile supercharger station has started to make a profit in a single month,2020-01-13,sales_marketing,ev_all,EV
611,611,"BMW is a bit deep in making trams. Technically speaking, it has learned a lot of good things from the electric formula. The electric horse is still very BMW.",2020-01-15,user_experience,ev_all,EV
612,612,Tesla's market value is approaching $100 billion,2020-01-15,stock,ev_all,EV
613,613,"[New car Kia's new electric vehicle platform will be launched in 2021] By 2025, Kia Motors will release 11 electric models. Kia currently has electric models such as Soul EV and Niro EV, all of which are based on the old electric vehicle platform. According to foreign media information, the Imagine model to be mass-produced is based on Kia's independent electric vehicle platform and will not be shared with Hyundai.",2020-01-16,product,ev_all,EV
614,614,BYD/Daimler added another 700 million yuan to Denza,2020-01-16,stock,ev_all,EV
615,615,"First BMW, then Mercedes, Daimler AG has determined that on some EQC vehicles the bolts in the front axle differential may not meet durability specifications, therefore, the possibility of the bolts breaking over their useful life cannot be ruled out. Mercedes-Benz EQC is recalled before it goes on the market!",2020-01-17,product,ev_all,EV
616,616,"The dual 10.25-inch instrument panel and central control screen greatly enhance the sense of technology in the car. The information displayed on the instrument is rich, and three different UIs can be provided according to different driving modes. The central control screen is equipped with the latest MBUX system, which supports multi-touch operation.",2020-01-17,product,ev_all,EV
617,617,"A few days ago, Kia Motors is preparing to build a pure electric model, which is expected to be launched in 2021. This is also an important part of Kia Motors' global strategy ""S Plan"". According to the content of the strategy, Kia Motors will release 11 electric models by 2025",2020-01-22,sales_marketing,ev_all,EV
618,618,"Foreign media reported that Kia Motors will debut its newly designed Logo before the end of this year, and the new Logo is likely to be the first to be carried on plug-in hybrid models and pure electric models. The pure electric vehicle that Kia will release next is the mass-produced version of the Imagine concept car. The logo on the concept car is similar to the new logo, which is more modern and avant-garde. The car is positioned to surpass the existing e-Niro and Seltos EV pure electric vehicles, and is expected to be launched in 2021.",2020-01-22,product,ev_all,EV
619,619,"Xiaopeng Automobile's automatic parking success rate reaches 70%, Tesla only 13%",2020-02-02,product,ev_all,EV
620,620,Tesla's Shanghai factory resumed work on February 10,2020-02-08,product,ev_all,EV
621,621,"As of the end of 2018, all Chinese auto companies (including joint ventures) had the top 10 invention patents, and BYD topped the list. What's even more frightening is that the number of invention patents it owns is the sum of the second to tenth! Peek at the hair and know the whole body. What a small mask reflects is BYD's keen strategic response speed, complete range of manufacturing capabilities, strong execution, and most importantly, its sense of responsibility and mission as a national enterprise. What Wang Chuanfu said last year, ""Being grateful for the reform and opening up, and determined to serve the country with industry"" is by no means empty words.",2020-02-10,technical_innovation,ev_all,EV
622,622," Didi Chuxing entered the Mexican market in April 2018, covering half of the country's population, providing ride-hailing, taxi and food delivery services in 32 cities in the country. Didi Mexico recently announced that it will add more than 700 new energy vehicles, including new energy manufacturers such as BYD and Renault.",2020-02-10,sales_marketing,ev_all,EV
623,623,"Xiaopeng Motors, which originally planned to complete 30 bilLi on yuan in financing in 2019, only announced a 400 milLi on yuan financing, while Byton, which is expected to complete the C round of financing in June, was once postponed to January this year. A direct result of the lack of funding is a stalled product schedule. According to the previously announced plans of each company, 2019 should have been a big year for the deLi very of new car companies, but only Li Auto reaLi zed the personal deLi very of the main models, in time for December.​",2020-02-12,stock,ev_all,EV
624,624,Volkswagen exhaust pollutes the environment,2020-02-13,environment,ev_all,EV
625,625,"Tesla is a new energy vehicle positioned in the high-end market. As far as the Chinese market is concerned, it does not belong to the audience products of the main sales market, but belongs to the high-end market share. Then BMW, Mercedes-Benz, Audi and other high-end brands will not sit still and will compete with each other. Bargain to snatch this limited high-end market share.",2020-02-15,sales_marketing,ev_all,EV
626,626,"""Toyota + BYD"" pure electric vehicles may be put into production in the new plant! In fact, this is the second time FAW Toyota has expanded its new energy vehicle production capacity in the past two years. In August 2018, the new energy vehicle transformation project of Tianjin FAW Toyota TEDA factory was approved. According to the plan, the total investment of the transformation project is 1.762 billion yuan, which will increase the annual production capacity of 120,000 new energy vehicles for the TEDA factory, including plug-in hybrid vehicles. 110,000 models and 10,000 pure electric models.",2020-02-15,sales_marketing,ev_all,EV
627,627,"In addition to the Volkswagen ID series, what other models use high-pressure carbon dioxide as the refrigerant for heat pump air conditioners?",2020-02-17,product,ev_all,EV
628,628,Tesla's German Gigafactory runs aground,2020-02-21,product,ev_all,EV
629,629,The emergence of Audi Q2L e-tron and e-tron has established Audi's new energy pure electric vehicle layout in China before 2020. Audi's sales in the next era have laid a solid foundation.,2020-02-23,technical_innovation,ev_all,EV
630,630,"Xpeng P5 has achieved excellent results in intelligent driving, intelligent safety, intelligent interaction, and intelligent energy efficiency, fully demonstrating the strength of intelligent full-stack self-development",2020-02-24,product,ev_all,EV
631,631,"Hello, brothers! Today we are going to talk about a more controversial car-ideal one! Is it worth spending 300,000 yuan on an extended-range new energy vehicle that comes with a bottle? How to choose between the second-hand BMW X5 and the new Audi Q5L at the same price?",2020-03-01,cost,ev_all,EV
632,632,"According to the objective laws of the pre-research generation, development generation, and mass production generation, the launch of the blade battery and the mass production of the ""Han"" car family can only represent the highest development of BYD's power battery, electric drive subsystem and model platform around 2018. techinque level.",2020-03-03,technical_innovation,ev_all,EV
633,633,The drifting Audi e-tron S has a total of three motors with a maximum power of 370 kW and a maximum torque of 973 Nm.,2020-03-08,product,ev_all,EV
634,634,The Ministry of Industry and Information Technology interviewed Tesla,2020-03-10,public_relations,ev_all,EV
635,635,"According to BYD's announcement on March 10, the Finance Bureau of Xi'an High-tech Zone will allocate 1.983 billion yuan to BYD. The name of the fund is the central financial subsidy for the promotion and application of new energy vehicles in 2018. As of the announcement date, 1 billion yuan has been allocated to the account. According to the announcement on March 2, BYD has also recently received 1.342 billion yuan in central financial subsidies for the promotion and application of new energy vehicles in 2017 from the Shenzhen Pingshan District Finance Bureau. Since the beginning of 2020, the national new energy vehicle promotion subsidy funds have begun to be liquidated. In addition to BYD, Yutong Bus, Dongfeng Motor, Beiqi Foton, etc. have also received subsidy funds one after another.",2020-03-11,macroeconomics,ev_all,EV
636,636,Chinese car owners want to collectively sue Tesla,2020-03-11,public_relations,ev_all,EV
637,637,Tesla is the most valuable industrial company in the United States,2020-03-12,stock,ev_all,EV
638,638,"Some time ago, Jaguar I-Pace and Audi e-tron were suspected to have stopped production due to insufficient production capacity of their supplier LG Chem. It seems that the battery production capacity of CATL and Samsung SDI is relatively stable.",2020-03-13,product,ev_all,EV
639,639,Ideal cars will use BYD batteries to ensure stable battery supply,2020-03-13,sales_marketing,ev_all,EV
640,640,"From CEO He Xiaopeng to the main support of Ali Xiaomi, Xiaopeng G3 does not seem to have any ""car-making background"", which is highly similar to Tesla. The products made by ""Musk's Chinese apprentices"" have no surprising innovations except for the super charging station. It can be said that the price is the only comforting place.",2020-03-15,public_relations,ev_all,EV
641,641,"Kia Motors announced a ""S plan"" to the outside world. It is expected to produce 11 pure electric vehicles in 2025. More details have not yet been disclosed. A pure electric model, the latter will be the first to be available in the US market",2020-03-17,product,ev_all,EV
642,642,Kia also revealed that future new cars will be based on a new electric vehicle platform.,2020-03-17,product,ev_all,EV
643,643,"German high-end luxury custom car brand HOFELE has released a set of official images of the Mercedes-Benz EQC after the company's redesign and modification. The appearance of the new car has only been adjusted in some details. While maintaining the original car design, the interior is only more high-end in terms of materials and craftsmanship.",2020-03-17,product,ev_all,EV
644,644,"Electrification is an important part of Volkswagen's 2025 strategy, and the Audi brand will become the mainstay of Volkswagen Group in China",2020-03-17,public_relations,ev_all,EV
645,645,"Car dealers under the epidemic situation: 30% of the employees return to work on rotation, and the passenger flow is gradually picking up--car-sales decline, which is the most direct terminal retail performance in the current auto market. In order to stabilize operations, more than 80% of stores have resumed work. On March 6, Beijing Youth Daily visited more than a dozen 4S stores, involving Audi",2020-03-18,sales_marketing,ev_all,EV
646,646,"At the Global Smart Car Frontier Summit in June 2018, Wang Chuanfu gave this view: ""Smart cars can only be truly innovative if they are open."" About two years later, BYD's ""open"" strategy began to advance to 2.0",2020-03-18,public_relations,ev_all,EV
647,647,Tesla's California factory ordered to suspend production,2020-03-18,macroeconomics,ev_all,EV
648,648,NIO's net loss of 11.4 billion in 2019,2020-03-19,sales_marketing,ev_all,EV
649,649,"High-performance electric vehicle brand – Polestar delivered Polestar 1 to the first batch of car owners in China with the innovative delivery mode of ""Polestar Home"". At the moment when the epidemic has not yet completely subsided, Polestar provides users with an exclusive ""Polestar home delivery"" delivery service, and the vehicle will be delivered to the location designated by the owner for delivery. Polestar car owners can get their car as soon as possible without going out or waiting.",2020-03-19,user_experiecne,ev_all,EV
650,650,"Production of the Audi e-tron electric SUV has been temporarily discontinued. German and Belgian media reported yesterday: ""Audi confirmed that due to insufficient supply of parts, the production of e-tron has been suspended for four days."" At present, Mercedes-Benz, Hyundai and Jaguar have temporarily suspended production due to battery supply problems of LG Chem.",2020-03-20,product,ev_all,EV
651,651,"Audi announces new energy strategy: 17 new models will be launched in 2020, and sales will increase to 40% within 5 years",2020-03-20,sales_marketing,ev_all,EV
652,652,"Real-time broadcast: BYD H share announcement: Affected by the novel coronavirus pneumonia epidemic, it is difficult for BYD to publish the audited 2019 annual performance announcement before March 31. The board of directors will publish the key data of the 2019 unaudited financial performance on March 31 Announcement, together with audited comparative figures for the same period in 2018.",2020-03-20,macroeconomics,ev_all,EV
653,653,Musk says Tesla may produce ventilators,2020-03-20,public_relations,ev_all,EV
654,654,"Funding has always been the number one problem facing new car-making forces. Automobile is a typical technology and capital-intensive industry, and it is also one of the industries with the lowest survival rate for start-ups. The cash flow crisis that Tesla has experienced is also a huge test that is generally faced in China. Li Auto is no exception. At present, the company still reLi es on external blood transfusion. According to financial data, as of the first half of 2019, Li Auto's operating income was about 5.2776 milLi on yuan, its net profit was about -629 milLi on yuan, its total assets were about 5.842 bilLi on yuan, and its total Li abiLi ties were 931 milLi on yuan.",2020-03-23,stock,ev_all,EV
655,655,"On Monday local time, Polestar, Volvo's electric car division, revealed that despite the spread of the new coronavirus, the company will begin mass production of its pure electric car Polestar 2 at its Luqiao plant in Taizhou, Zhejiang Province from this week... : Volvo Polestar 2 will be mass-produced this week, directly related to the standard Tesla Model 3",2020-03-24,marcoeconomics,ev_all,EV
656,656,Tesla to lay off 75% of U.S. workers,2020-03-27,macroeconomics,ev_all,EV
657,657,Tesla to reopen New York factory to make ventilators,2020-03-27,macroeconomics,ev_all,EV
658,658,VW CEO says no revenue outside China,2020-03-28,sales_marketing,ev_all,EV
659,659,"Kia Motors confirmed that it will launch the mass-produced version of the SUV concept car Imagine in the second half of 2021, internally code-named ""CV"". Technology for brand collaborations.",2020-03-31,product,ev_all,EV
660,660,"Recently, foreign media exposed the renderings of the travel version of Polestar 2 (Polestar 2). Compared with the sedan version that will be made in China at this stage, the travel version is obviously a more practical choice. If it can be put into production in the future , Polestar will provide consumers with a richer choice of models than the Tesla Model 3.",2020-04-01,product,ev_all,EV
661,661,"On the morning of April 30th, at the Li  Auto spring media communication meeting, Li  Auto CEO Li  Xiang said that since the official start of deLi very in December 2019, Li ONE has deLi vered more than 6,500 vehicles, of which this year's Li ONE deLi vered in April exceeded 2600 vehicles.",2020-04-02,public_relations,ev_all,EV
662,662,"BYD's ""2019 Annual Performance Express"" operating income decreased by 1.78% compared with 2018, but net profit decreased by 42.03% compared with the same period last year. The big market is not good, and the auto industry is the worst industry. This report by BYD has already led most of its peers in the industry as a whole.",2020-04-02,sales_marketing,ev_all,EV
663,663,Tesla to donate FDA-approved ventilators,2020-04-02,macroeconomics,ev_all,EV
664,664,"From January to February 2018, the first batch of Yinlong 11 meters and BYD K8 in Nanjing were put into operation on roads 19, 27, 84, and 60​",2020-04-04,sales_marketing,ev_all,EV
