Unnamed: 0.1,Unnamed: 0,Text Blocks,Timestamp,Category,Company,Stock
948,948,"Xiaomi invested in Xpeng Motors, Meituan invested in Ideal Auto, Hillhouse/IDG/Tencent invested in NIO, and Huawei independently developed Huawei Auto.",2021-03-19,stock,ev_all,EV
949,949,"Musk talks with Xue Qikun, academician of the Chinese Academy of Sciences",2021-03-20,public_relations,ev_all,EV
950,950,"In He Xiaopeng's view, among the major new car-making forces, Xiaopeng Motors spends the highest proportion of R&D expenses and personnel, and invests the most in intelligent self-research. It is understood that Xiaopeng Motors’ research and development investment in 2019 reached 2.07 billion yuan, a substantial increase from 2018, and Xiaopeng Motors’ research and development investment accounted for 89.18% of revenue in 2019.",2021-03-20,public_relations,ev_all,EV
951,951,Musk says he won't share Chinese customer data with U.S. government,2021-03-21,public_relations,ev_all,EV
952,952,The texture of the Polestar 1 Gold Edition is invincible.,2021-03-22,user_experiecne,ev_all,EV
953,953,Musk says China will become the largest market for new energy vehicles,2021-03-23,public_relations,ev_all,EV
954,954,"Recently, Polestar Auto Sales Co., Ltd. announced the recall of a batch of 2021 domestically produced Polestar 2 first edition pure electric vehicles, a total of 2,031 vehicles. The vehicles within the scope of this recall may lose power during driving due to the reset of the microprocessor in the power battery energy control module.",2021-03-24,product,ev_all,EV
955,955,Musk praises China's carbon peak goal,2021-03-24,environment,ev_all,EV
956,956,Tesla U.S. Official Website Supports Bitcoin Payments,2021-03-24,stock,ev_all,EV
957,957,Tesla Responds to Supporting Bitcoin Payments,2021-03-24,stock,ev_all,EV
958,958,"According to the trademark announcement of the State Intellectual Property Office, NIO Automobile has registered a new model trademark - EF9. In August 2018, NIO revealed its new product plan in its IPO prospectus. At that time, five new models were planned, including the NIO ES3 positioned as a compact SUV, the NIO ET5 positioned as a crossover Coupe, and the NIO positioned as a sedan. NIO ET3, ET7 and NIO EF9 positioned as MPV models.",2021-03-26,technical_innovation,ev_all,EV
959,959,NIO Automobile responds to the lack of cores and suspends production for 5 days,2021-03-27,macroeconomics,ev_all,EV
960,960,NIO Automobile stopped production for 5 days due to lack of core,2021-03-27,macroeconomics,ev_all,EV
961,961,Tesla vice president says the probability of vehicle loss of control is small,2021-03-30,product,ev_all,EV
962,962,Musk responds to SpaceX starship explosion,2021-04-01,public_relations,ev_all,EV
963,963,High-definition picture of Tesla's interior camera,2021-04-06,product,ev_all,EV
964,964,Tesla responds to in-car camera issues,2021-04-07,product,ev_all,EV
965,965,"Polestar (Polestar) officially announced that it plans to achieve carbon neutrality by 2030. The plan is called ""Polestar 0"".",2021-04-08,environment,ev_all,EV
966,966,Pudong Automobile Management Office responds to stop licensing Tesla,2021-04-08,public_relations,ev_all,EV
967,967,Musk released a video of monkeys playing games with their minds,2021-04-09,public_relations,ev_all,EV
968,968,"Li Juan, a double-faced person in BYD advertising, was sentenced to 14 years in prison",2021-04-14,public_relations,ev_all,EV
969,969,"Xiaopeng Motors G3 has participated in the second batch of China New Car Evaluation Procedure (C-NCAP) tests in 2019. It is one of the first batch of pure electric models to participate in the test and obtain a five-star evaluation after the release of the 2018 version of the C-NCAP test rules. With a comprehensive score of 92.2%, it won the five-star evaluation of the C-NCAP test. In 2020, Xiaopeng Motors G3 participated in the crash test of China Insurance Research Institute and won 4 ""excellent"" and 2 ""good"" results",2021-04-14,user_experience,ev_all,EV
970,970,"On April 15, 2021, Polestar, a global high-performance electric vehicle brand from Sweden, announced that it has received US$550 million in financing, all of which are long-term financial investors.",2021-04-15,stock,ev_all,EV
971,971,Xiaopeng car spontaneously ignites at charging station,2021-04-15,product,ev_all,EV
972,972,Musk Beats Bezos to NASA's Moon Landing Project,2021-04-17,public_relations,ev_all,EV
973,973,"Unlock Polestar, good product",2021-04-19,product,ev_all,EV
974,974,Shanghai auto show Tesla female owner's car roof rights protection was dragged away,2021-04-19,user_experience,ev_all,EV
975,975,Tesla booth turned into rights protection site,2021-04-19,user_experience,ev_all,EV
976,976,2 killed as Tesla hits tree and catches fire,2021-04-19,product,ev_all,EV
977,977,Volkswagen's largest SUV,2021-04-20,product,ev_all,EV
978,978,Activist owner of Tesla auto show apologizes,2021-04-20,public_relations,ev_all,EV
979,979,Tesla says it will not compromise on unreasonable demands,2021-04-20,public_relations,ev_all,EV
980,980,Vice President of Tesla China Responds to Auto Show Rights Protection Incident,2021-04-20,public_relations,ev_all,EV
981,981,"According to the Automobile Value Preservation Rate Report for April released by the China Automobile Dealers Association, the top three new energy second-hand car models are Tesla MODEL S, BYD Tang DM, and BMW 5 Series PHEV, with value retention rates of 60.9%, 50.8% and 47%.",2021-04-21,cost,ev_all,EV
982,982,Police respond to out-of-control Tesla fire in Guangzhou,2021-04-21,product,ev_all,EV
983,983,Ping An Property & Casualty Responds to Refusal to Cover Tesla,2021-04-21,product,ev_all,EV
984,984,Tesla apologizes,2021-04-21,public_relations,ev_all,EV
985,985,Ping An auto insurance in some provinces and cities refuses to insure new Tesla owners,2021-04-21,public_relations,ev_all,EV
986,986,Tesla Tao Lin absent from Boao Forum for Asia,2021-04-21,public_relations,ev_all,EV
987,987,A Tesla in Nanning hangs a banner to defend its rights,2021-04-21,user_experience,ev_all,EV
988,988,City Supervision Bureau Responds to Tesla Auto Show Rights Protection,2021-04-21,user_experience,ev_all,EV
989,989,Central Political and Legal Committee Comments on Tesla Auto Show Rights Protection,2021-04-21,user_experience,ev_all,EV
990,990,Tesla face trademark is registered,2021-04-22,competition,ev_all,EV
991,991,Tesla says it will provide driving data before accident,2021-04-22,user_experience,ev_all,EV
992,992,China Consumers Association Responds to Tesla Owners' Rights Protection Incident,2021-04-22,user_experience,ev_all,EV
993,993,State Administration for Market Regulation responds to Tesla incident,2021-04-22,user_experience,ev_all,EV
994,994,Tesla ordered to provide driving data before accident,2021-04-22,public_relations,ev_all,EV
995,995,Guangzhou traffic police refute rumors and ban Tesla on expressway,2021-04-23,public_relations,ev_all,EV
996,996,Tesla released a statement on car owners' rights protection,2021-04-23,public_relations,ev_all,EV
997,997,No one in the Tesla driving seat can drive automatically,2021-04-23,technical_innovation,ev_all,EV
998,998,Husband of rights-defending female car owner does not approve of Tesla's driving data,2021-04-23,public_relations,ev_all,EV
999,999,Tesla speaks late at night again,2021-04-23,public_relations,ev_all,EV
1000,1000,Experts interpret the data provided by Tesla,2021-04-23,public_relations,ev_all,EV
1001,1001,Tesla provides 1-minute data before braking accident,2021-04-23,public_relations,ev_all,EV
1002,1002,Tesla says it will cooperate with investigations and be supervised,2021-04-23,public_relations,ev_all,EV
1003,1003,"BMW i7—a luxury executive-level pure electric car. After reading it, I can only say work hard, young man, it’s very expensive",2021-04-24,cost,ev_all,EV
1004,1004,Woman slapped by two men after scratching Mercedes,2021-04-24,cost,ev_all,EV
1005,1005,"The domestic version of Volkswagen ID.4 is released, with a battery life of 550 kilometers and a starting price of 250,000",2021-04-24, cost,ev_all,EV
1006,1006,Insiders Restore Guangzhou Tesla's Death by Hitting a Wall,2021-04-24,public_relations,ev_all,EV
1007,1007,Musk wants to build a permanent base on the moon,2021-04-24,public_relations,ev_all,EV
1008,1008,"Rent 700,000 yuan BMW car and sell it for 200,000 yuan",2021-04-25,sales_marketing,ev_all,EV
1009,1009,"As the first hybrid model of M, the domestic price of BMW XM is 2.36 million yuan.",2021-04-25,cost,ev_all,EV
1010,1010,4 injured in Xiamen Tesla collision with electric car,2021-04-25,product,ev_all,EV
1011,1011,Police report Xiamen Tesla crash accident,2021-04-25,product,ev_all,EV
1012,1012,Tesla owner wins first trial,2021-04-25,user_experience,ev_all,EV
1013,1013,The proportion of BMW's new energy vehicles has increased year by year.,2021-04-26,sales_marketing,ev_all,EV
1014,1014,Tesla's late-night response will push third-party testing,2021-04-26,product,ev_all,EV
1015,1015,Tesla car roof activist released,2021-04-26,public_relations,ev_all,EV
1016,1016,Tesla refuses to disclose the truth of the data,2021-04-26,public_relations,ev_all,EV
1017,1017,Tesla rights activist denies rumors that NIO is a supporter,2021-04-27,competition,ev_all,EV
1018,1018,NIO responds to involvement in Tesla rights protection incident,2021-04-27,competition,ev_all,EV
1019,1019,NIO President Responds to Being Involved in Tesla Rights Protection Incident,2021-04-27,competition,ev_all,EV
1020,1020,"German and Japanese boutique small electric comparison test, Honda e vs VW ID, choose vw",2021-04-27,competition,ev_all,EV
1021,1021,A Tesla in Jiangsu stormed into a steamed stuffed bun shop,2021-04-27,product,ev_all,EV
1022,1022,Tesla rights activist denies rumors that NIO is a supporter,2021-04-27,competition,ev_all,EV
1023,1023,NIO responds to involvement in Tesla rights protection incident,2021-04-27,competition,ev_all,EV
1024,1024,NIO President Responds to Being Involved in Tesla Rights Protection Incident,2021-04-27,competition,ev_all,EV
1025,1025,"NIO officially announced that NIO's 100,000th mass-produced vehicle rolled off the assembly line at the advanced manufacturing base in Hefei. Later, Elon Musk forwarded this Weibo to express his congratulations and said that this is a difficult milestone. Since the first ES8 mass-produced car rolled off the assembly line on May 27, 2018, and the 100,000th mass-produced car rolled off the assembly line on April 7, 2021, it took NIO only 1,046 days to complete the transformation of high-end smart electric vehicles from 0 to The leap of 100,000 vehicles has created a new speed in the industry.​",2021-04-28,sales_marketing,ev_all,EV
1026,1026,"On April 28, the world-renowned ""Top Gear Magazine"" awarded Polestar 2 the title of ""Best All-round Electric Vehicle of the Year"" in the 2021 Electric Vehicle Selection",2021-04-28,user_experiecne,ev_all,EV
1027,1027,Li  Xiang talks about whether employees should apologize for insulting others,2021-04-28,public_relations,ev_all,EV
1028,1028,Tesla claims there was a mastermind for the auto show rights protection incident,2021-04-28,competition,ev_all,EV
1029,1029,Tesla released the progress and event description of car owners' rights protection,2021-04-28,public_relations,ev_all,EV
1030,1030,NIO responds to auto show uniformed man insulting exhibitors,2021-04-29,public_relations,ev_all,EV
1031,1031,Tesla's revenue in China surged 238% year-on-year in the first quarter,2021-04-29,sales_marketing,ev_all,EV
1032,1032,Tesla rights activist says self-insurance lied about pregnancy,2021-04-30,public_relations,ev_all,EV
1033,1033,Buffett responds to Musk's underwriting of Mars immigration,2021-05-02,public_relations,ev_all,EV
1034,1034,Tesla recalls 561 imported cars in South Korea,2021-05-02,product,ev_all,EV
1035,1035,"Audi crashed into isolation belt and flew into the air, 4 people were slightly injured",2021-05-03,product,ev_all,EV
1036,1036,Tesla responds to Guangzhou underground parking lot accident,2021-05-03,product,ev_all,EV
1037,1037,Tesla activist wants talks back on track,2021-05-03,public_relations,ev_all,EV
1038,1038,Tesla may launch a data platform within the year,2021-05-06,technical_innovation,ev_all,EV
1039,1039,Audi and DJI formed a CP,2021-05-07,sales_marketing,ev_all,EV
1040,1040,"In 2020, when the stock price and sales volume are soaring, Li  Auto, which was once questioned, won status and applause for itself with sales volume, and fought a beautiful turnaround. According to the official information of Li Automobile, the cumulative sales volume of the Li ONE model on sale has successfully exceeded 40,000 units.",2021-05-07,user_experience,ev_all,EV
1041,1041,Tesla responds to Anyang car owner's lawsuit,2021-05-07,user_experience,ev_all,EV
1042,1042,Husband of female car owner responds to suing Tesla vice president,2021-05-07,public_relations,ev_all,EV
1043,1043,Activist female car owner sues Tesla vice president,2021-05-07,public_relations,ev_all,EV
1044,1044,A community in Lanzhou banned Tesla from entering,2021-05-07,user_experience,ev_all,EV
1045,1045,Tesla Model 3 announces price increase,2021-05-08,cost,ev_all,EV
1046,1046,"Tesla owner dies after rear-end collision, police report",2021-05-08,product,ev_all,EV
1047,1047,Tesla responds to rear-end truck accident,2021-05-08,product,ev_all,EV
1048,1048,A Tesla rear-ends a truck in Shaoguan,2021-05-08,product,ev_all,EV
1049,1049,Xiaopeng Motors responds to car owners' brake failure rights protection,2021-05-08,product,ev_all,EV
1050,1050,The deceased in the Shaoguan Tesla accident was a retired policeman,2021-05-09,product,ev_all,EV
1051,1051,Tesla has raised prices 6 times this year,2021-05-09,cost,ev_all,EV
1052,1052,The expert team will conduct a comprehensive inspection of the Tesla accident vehicle in Shaoguan,2021-05-09,product,ev_all,EV
1053,1053,Wang Chuanfu claims Huawei mobile phones are made by BYD,2021-05-10,public_relations,ev_all,EV
1054,1054,Musk claims to have Asperger's Syndrome,2021-05-10,public_relations,ev_all,EV
1055,1055,"Trace the source of raw materials and greenhouse gas emissions Polestar and Circulor strategic cooperation. On May 11, Polestar Polestar and blockchain technology company Circulor established a strategic partnership, advocating to improve the transparency of the entire automotive industry, and accelerate the automotive industry to climate neutrality. move forward with the goal. In April 2021, Polestar announced that it will produce climate-neutral vehicles by 2030",2021-05-11,environment,ev_all,EV
1056,1056,Musk Launches Dogecoin to Pay Tesla Votes,2021-05-11,stock,ev_all,EV
1057,1057,Tesla Suspends Bitcoin Payments,2021-05-13,stock,ev_all,EV
1058,1058,American internet celebrity angrily accuses Musk of suppressing Bitcoin,2021-05-14,public_relations,ev_all,EV
1059,1059,Musk Blames Bitcoin for Energy Consumption,2021-05-14,public_relations,ev_all,EV
1060,1060,"On May 11, Polestar, a global high-performance electric vehicle brand, established a strategic partnership with Circulor, a blockchain technology company, advocating to improve the transparency of the entire automotive industry and accelerate the automotive industry's progress towards climate neutrality. In April 2021, Polestar announced that it will produce climate-neutral vehicles by 2030. This strategic cooperation is an important step towards sustainability and transparency for Polestar.",2021-05-16,public_relations,ev_all,EV
1061,1061,Tesla responds to Hangzhou underground garage accident,2021-05-16,product,ev_all,EV
1062,1062,Musk congratulates Tianwen-1 for landing on Mars,2021-05-16,public_relations,ev_all,EV
1063,1063,Musk hints that Tesla may have sold Bitcoin,2021-05-17,public_relations,ev_all,EV
1064,1064,A Tesla in Zhejiang knocks down two traffic policemen,2021-05-18,product,ev_all,EV
1065,1065,A Tesla in Guangzhou spontaneously combusts after hitting a tree,2021-05-19,product,ev_all,EV
1066,1066,"Tesla crashes into traffic police in Taizhou, 1 dies",2021-05-19,product,ev_all,EV
1067,1067,"Between 80,000 and 100,000 ID models are expected to be sold in China by the end of the year, according to Automotive News.",2021-05-20,sales_marketing,ev_all,EV
1068,1068,Musk says all future transportation will be electric,2021-05-21,public_relations,ev_all,EV
1069,1069,Musk says he will never sell Dogecoin,2021-05-21,public_relations,ev_all,EV
1070,1070,"Polestar has discovered many potential new stars in the first match, and witnessed the whole process of design from creative sketches to 3D models, demonstrating the extremely high creativity and technological capabilities of designers. This event also confirmed that Polestar explores and persists in future travel changes. The 2021 Polestar Global Design Competition will be held soon. Let us look forward to how many wonderful works will be presented in the end!",2021-05-24,sales_marketing,ev_all,EV
1071,1071,Tesla has established a data center in China,2021-05-25,user_experience,ev_all,EV
1072,1072,5 dead suspects in Dalian BMW crash,2021-05-26,product,ev_all,EV
1073,1073,Tesla may face a huge claim of 1 billion yuan,2021-05-26,public_relations,ev_all,EV
1074,1074,"Who would say no to a BMW? BMW's deep-rooted sports blood makes everyone who loves ""driving"" want to stop, and this i3 continues this car-making philosophy. In this car, the difference between ""oil"" and ""electricity"" has become blurred. The important thing is that it is still the BMW that makes you happy to drive",2021-05-27,user_experience,ev_all,EV
1075,1075,"No matter how beautiful Mercedes-Benz, BMW, and Audi are, how powerful their performance is, and how good their handling is, I still think that bba cars are far inferior to domestic new energy vehicles.",2021-05-28,user_experience,ev_all,EV
1076,1076,Li Bin said that the post-00s are more willing to buy Chinese brands,2021-06-01,public_relations,ev_all,EV
1077,1077,Musk responds to Tesla price hike,2021-06-01,public_relations,ev_all,EV
1078,1078,Motorcycle Reported Tesla Retrograde and He Was Fined,2021-06-02,user_experience,ev_all,EV
1079,1079,Tesla Files for Foodservice Trademark,2021-06-02,competition,ev_all,EV
1080,1080,Tesla's flagship model will use AMD chips,2021-06-02,technical_innovation,ev_all,EV
1081,1081,Tesla apologizes to owners trapped in cars,2021-06-03,public_relations,ev_all,EV
1082,1082,Tesla recalls 734 imported Model 3s,2021-06-03,product,ev_all,EV
1083,1083,Tesla responds to car owner being trapped in car for suffocation,2021-06-03,product,ev_all,EV
1084,1084,Academician said that China's brain-computer interface technology has caught up with Musk in 5 years,2021-06-04,public_relations,ev_all,EV
1085,1085,Musk tweets heartbroken emoji,2021-06-04,public_relations,ev_all,EV
1086,1086,Tesla's market value has evaporated by nearly 200 billion,2021-06-04,stock,ev_all,EV
1087,1087,Tesla orders in China halved in May,2021-06-04,sales_marketing,ev_all,EV
1088,1088,"Volkswagen Anhui will domestically produce the Volkswagen brand and Seat's high-performance Cupra models. The first two models are code-named SE316/8 and VW316/8, respectively Cupra Tavascan and Volkswagen ID",2021-06-05,product,ev_all,EV
1089,1089,"A few days ago, we learned from the official of Li Auto that on May 2, Li Auto announced the deLi very data for April. Li ONE deLi vered 5,539 vehicles in April, an increase of 111.3% year-on-year in April 2020.",2021-06-05,sales_marketing,ev_all,EV
1090,1090,Taizhou 517 accident has nothing to do with Tesla vehicles,2021-06-06,product,ev_all,EV
1091,1091,Billionaires including Musk accused of years of tax evasion,2021-06-09,public_relations,ev_all,EV
1092,1092,"To supply BMW, Envision Power plans to invest 810 million US dollars to build a battery factory in the United States",2021-06-10,sales_marketing,ev_all,EV
1093,1093,"Musk says he now rents a $50,000 house",2021-06-10,public_relations,ev_all,EV
1094,1094,SAIC Volkswagen exec says Tesla is not customer-centric,2021-06-13,competition,ev_all,EV
1095,1095,"VW, Ford stop lending to Indian car buyers",2021-06-13, cost,ev_all,EV
1096,1096,SAIC Volkswagen exec says Tesla is not customer-centric,2021-06-13,competition,ev_all,EV
1097,1097,"According to the prospectus of Xiaopeng Motors, the company's total revenue has grown rapidly from RMB 9.7 million in 2018 to RMB 2.321 billion in 2019, and will further increase to RMB 5.844 billion in 2020.",2021-06-13,stock,ev_all,EV
1098,1098,Secretary of the Hefei Municipal Party Committee deciphers why he invested in NIO,2021-06-14,public_relations,ev_all,EV
1099,1099,Tesla Sells About 10% of Its Bitcoin Holdings,2021-06-14,stock,ev_all,EV
1100,1100,Tesla will resume allowing bitcoin transactions,2021-06-14,stock,ev_all,EV
1101,1101,"Strange battery supplier: Shanghai Delang can sell faulty batteries, Xiaopeng Motors was awarded 1.92 million in compensation",2021-06-14,sales_marketing,ev_all,EV
1102,1102,Musk decides to sell his last real estate,2021-06-15,public_relations,ev_all,EV
1103,1103,"Polestar has released a teaser image of the brand new SUV Polestar 3, which will be produced in both China and the United States. Officially positioned as a high-performance electric SUV, it will be produced on the same line as Volvo's new models at the Volvo production base in Ridgeville, South Carolina, USA, to supply the North American market; the domestic production plant will be announced in the future",2021-06-17,product,ev_all,EV
1104,1104,Former Tesla executive sells $270 million in stock,2021-06-20,stock,ev_all,EV
1105,1105,"The Kia EV6 First Edition model will be officially delivered in early 2022. The new car will be sold in a limited number of 1,500 units. The starting price in the UK is 40,895 pounds, or about 369,700 yuan. In addition to the regular color combination, there is also a special urban yellow exterior color + dark green seats",2021-06-21,cost,ev_all,EV
1106,1106,"Overseas media have learned that the latest renderings of Kia's new Niro have been exposed. The new car has a novel exterior design with sharp edges and corners. Hybrid, plug-in hybrid and pure electric powertrains will be offered and are expected to debut in 2022.",2021-06-22,product,ev_all,EV
1107,1107,Land Rover courteously hits pedestrians by Mercedes-Benz,2021-06-22,competition,ev_all,EV
1108,1108,Audi announces that it will stop selling gasoline vehicles in 2033,2021-06-23,public_relations,ev_all,EV
1109,1109,BYD responds to discontinuation of fuel vehicles,2021-06-24,product,ev_all,EV
1110,1110,Musk's rental housing area is only 37 square meters,2021-06-24,public_relations,ev_all,EV
1111,1111,"Tesla responds to recall of 280,000 vehicles in China",2021-06-26,public_relations,ev_all,EV
1112,1112,Ningde era signed an agreement with Tesla,2021-06-29,sales_marketing,ev_all,EV
1113,1113,Musk encourages people to visit China,2021-07-01,public_relations,ev_all,EV
1114,1114,"Li xiang Auto said that if mercury is found in the vehicle, it must be an external behavior",2021-07-05,product,ev_all,EV
1115,1115,Li  Auto responds to mercury in seats,2021-07-05,public_relations,ev_all,EV
1116,1116,Zhou Hongyi said that Musk and Jia Yueting are both marketing masters,2021-07-05,public_relations,ev_all,EV
1117,1117,Musk admits developing self-driving cars is harder than thought,2021-07-06,public_relations,ev_all,EV
1118,1118,"Recently, Li  Xiang, the founder of Li Auto, mentioned in his circle of friends that a country with a per capita GDP of more than 10,000 US dollars is the greatest fortune for the rise of new national trendy brands. The United States in 1978, Germany in 1979, Japan in 1978 This is true in 1981 and in China in 2019.",2021-07-07,public_relations,ev_all,EV
1119,1119,Xiaopeng Motors officially listed on the Hong Kong Stock Exchange,2021-07-07,stock,ev_all,EV
1120,1120,"In May this year, Hyundai officially announced the official debut time of IONIQ 6 and IONIQ 7. Among them, IONIQ 6 is positioned as a pure electric sedan and will be unveiled in 2022; IONIQ 7 is positioned as a pure electric SUV and will be unveiled in 2024. In the next two years, Hyundai IONIQ Members of the pure electric vehicle family will arrive one after another.",2021-07-08,product,ev_all,EV
1121,1121,Tesla Model Y Standard Endurance Edition,2021-07-08,sales_marketing,ev_all,EV
1122,1122,"BMW plans to introduce hydrogen fuel vehicles in some of its large SUVs, such as the X6 and X7, from 2025.",2021-07-10,sales_marketing,ev_all,EV
1123,1123,BMW occupies Land Rover parking space and is blocked,2021-07-10,public_relations,ev_all,EV
1124,1124,VW and BMW fined 6.7 billion by EU,2021-07-10,cost,ev_all,EV
1125,1125,VW and BMW fined 6.7 billion by EU,2021-07-10, cost,ev_all,EV
1126,1126,"However, in the field of plug-in hybrid models, the BMW 5 Series PHEV is the well-deserved king. It sold a total of 2,336 new cars in July",2021-07-11,sales_marketing,ev_all,EV
1127,1127,2021 Kia Motors India Edition has highlights in latest advert,2021-07-12,sales_marketing,ev_all,EV
1128,1128,Tesla's big price cut triggers a chain reaction in the auto market,2021-07-12,competition,ev_all,EV
1129,1129,Two owners of Audi and Porsche were detained for drag racing,2021-07-13,public_relations,ev_all,EV
1130,1130,Tesla Model Y reservations scheduled until mid-September,2021-07-14,user_experience,ev_all,EV
1131,1131,"Japan's Toyota beat GM at home. Toyota tops the U.S. auto market in the second quarter of 2021. During the same period, Korean companies such as Hyundai Motor and Kia Motors also made great progress in the United States.",2021-07-15,competition,ev_all,EV
1132,1132,"Venue: National Convention and Exhibition Center (Shanghai) Hyundai and Beijing Hyundai Booth: Booth 4A07, Hall 4.1",2021-07-16,sales_marketing,ev_all,EV
