Unnamed: 0.1,Unnamed: 0,Text Blocks,Timestamp,Category,Company,Stock
1653,1653,"Once upon a time, Korean products could sell millions of products annually in the Chinese market. But recently, Korean cars seem to be a bit unpopular in China?",2022-10-19,user_experience,ev_all,EV
1654,1654,"The big brother in the Northeast drives a Mercedes-Benz to help his mother pull 300 catties of cabbage, which is incredible",2022-10-19,cost,ev_all,EV
1655,1655,BMW will invest another 10 billion to expand the Shenyang project,2022-10-20,product,ev_all,EV
1656,1656,"The Ministry of Industry and Information Technology has released a catalog of new energy vehicle models that are exempt from vehicle purchase tax, giving you information on interesting models: Mercedes-Benz AMG EQE 53 4 MATIC+, battery capacity 96.1 kWh, battery life 568 kilometers",2022-10-20,marcoeconomics,ev_all,EV
1657,1657,Tesla's new car costs half as much as Model 3,2022-10-20,cost,ev_all,EV
1658,1658,Musk says Tesla's market value may exceed $4 trillion,2022-10-20,public_relations,ev_all,EV
1659,1659,Tesla Releases Third Quarter 2022 Earnings,2022-10-20,sales_marketing,ev_all,EV
1660,1660,Foxconn CEO Says Hope to OEM Tesla,2022-10-20,public_relations,ev_all,EV
1661,1661,"Kia seems to me to be okay, sporting fashion technology, it seems to sell well in mature car markets like North America and Europe. It's a pity that the current domestic recognition of Korean cars is average.",2022-10-21,user_experience,ev_all,EV
1662,1662,Former Tesla director sees BYD as sole challenger,2022-10-21,competition,ev_all,EV
1663,1663,The price of BYD Tang in Germany is twice as high as that in China,2022-10-21,cost,ev_all,EV
1664,1664,Former Tesla director sees BYD as sole challenger,2022-10-21,competition,ev_all,EV
1665,1665,Musk says he plans to lay off 75% of Twitter employees,2022-10-21,public_relations,ev_all,EV
1666,1666,Tesla shares fell 6.65%,2022-10-21,stock,ev_all,EV
1667,1667,"To put it bluntly, this is very similar to Kia's enthusiasm for BYD. After all, not many people buy Korean cars now.",2022-10-22,competition,ev_all,EV
1668,1668,"Many years ago, the joint venture sedan Kia was more streamlined than the domestic sedan. But now, just the opposite, the design of domestic cars is becoming more and more avant-garde and individual. The main style of the design of this Yida model is sports.",2022-10-24,user_experience,ev_all,EV
1669,1669,BYD Denies Following Tesla in Price Cuts,2022-10-24,competition,ev_all,EV
1670,1670,Tesla's official price cut immediately triggered rights protection,2022-10-24,product,ev_all,EV
1671,1671,How Tesla's price cut will affect the market,2022-10-24,macroeconomics,ev_all,EV
1672,1672,Tesla customer service responds to price cuts,2022-10-24,public_relations,ev_all,EV
1673,1673,Tesla Model 3 and Model Y cut prices,2022-10-24,cost,ev_all,EV
1674,1674,Musk's net worth evaporated by more than 110 billion US dollars,2022-10-24,public_relations,ev_all,EV
1675,1675,BYD Denies Following Tesla in Price Cuts,2022-10-24,competition,ev_all,EV
1676,1676,Musk is not optimistic about flying cars,2022-10-26,public_relations,ev_all,EV
1677,1677,Musk promises to close Twitter acquisition by Friday,2022-10-26,public_relations,ev_all,EV
1678,1678,Musk says Apple's ad fees are too high,2022-10-27,public_relations,ev_all,EV
1679,1679,Musk appeared at Twitter headquarters,2022-10-27,public_relations,ev_all,EV
1680,1680,Musk may unblock Trump's Twitter account,2022-10-28,public_relations,ev_all,EV
1681,1681,Musk fires Twitter CEO and CFO,2022-10-28,public_relations,ev_all,EV
1682,1682,What it means for Musk to buy Twitter,2022-10-28,public_relations,ev_all,EV
1683,1683,Musk takes over as Twitter CEO,2022-10-28,public_relations,ev_all,EV
1684,1684,Musk completes deal to take Twitter private,2022-10-28,public_relations,ev_all,EV
1685,1685,Tesla wins lawsuit against boss Tsai,2022-10-31,public_relations,ev_all,EV
1686,1686,Musk becomes sole director of Twitter,2022-10-31,public_relations,ev_all,EV
1687,1687,Musk may lay off 50% of Twitter's staff,2022-10-31,public_relations,ev_all,EV
1688,1688,Musk will charge users for Twitter blue authentication,2022-11-01,public_relations,ev_all,EV
1689,1689,Musk asks Twitter engineers to silently write code,2022-11-01,public_relations,ev_all,EV
1690,1690,Musk decides to change Twitter homepage,2022-11-01,public_relations,ev_all,EV
1691,1691,Musk Says Solo CEO Is Just a Temporary Arrangement,2022-11-01,public_relations,ev_all,EV
1692,1692,Musk wants to transform Twitter into an overseas version of WeChat,2022-11-01,public_relations,ev_all,EV
1693,1693,Musk deploys cronies to help take over Twitter,2022-11-01,public_relations,ev_all,EV
1694,1694,NIO responds to suspension of production at vehicle plants,2022-11-02,product,ev_all,EV
1695,1695,Twitter employees work 12-hour days to prevent Musk layoffs,2022-11-02,public_relations,ev_all,EV
1696,1696,Has Musk started working on KPIs?,2022-11-02,public_relations,ev_all,EV
1697,1697,"Among the top ten bear stocks, Xiaopeng Motors fell the most, falling by nearly 80% for the whole year",2022-11-02,stock,ev_all,EV
1698,1698,"Kia's cars have always been pretty good, durable, and safe. From the perspective of gasoline vehicles, few other brands of the same level can surpass it; but as far as the current domestic situation is concerned, various car companies rely on subsidies New energy seems to be booming, but it is not certain who will win and who will lose in the end~",2022-11-03,user_experience,ev_all,EV
1699,1699,Musk plans to lay off 50% of Twitter staff,2022-11-03,public_relations,ev_all,EV
1700,1700,"1.43 million kilometers of maintenance, good after-sales service for Volkswagen",2022-11-04,sales_marketing,ev_all,EV
1701,1701,Can Musk reinvent Twitter?,2022-11-04,public_relations,ev_all,EV
1702,1702,Why did another BYD new energy vehicle catch fire in the street as soon as Kia executives spoke?,2022-11-05,competition,ev_all,EV
1703,1703,Tesla humanoid robot debuts in China,2022-11-05,technical_innovation,ev_all,EV
1704,1704,Tesla's market value has shrunk by 2.9 trillion,2022-11-05,stock,ev_all,EV
1705,1705,Biden responds to Musk buying Twitter,2022-11-05,public_relations,ev_all,EV
1706,1706,Musk now works 17 hours a day,2022-11-05,public_relations,ev_all,EV
1707,1707,Musk complains about huge drop in Twitter revenue,2022-11-05,public_relations,ev_all,EV
1708,1708,Li  L9 ranks first in the sales of full-size SUVs: No. 1 in China and No. 2 in the world. What kind of strength can make it sell more than the total sales of other brands of full-size SUVs,2022-11-06,sales_marketing,ev_all,EV
1709,1709,Twitter founder blames Musk for layoffs,2022-11-06,public_relations,ev_all,EV
1710,1710,Musk fires 90% of Indian Twitter staff,2022-11-07,public_relations,ev_all,EV
1711,1711,Musk cracks down on Twitter's high imitation account,2022-11-07,public_relations,ev_all,EV
1712,1712,Musk brings back dozens of laid-off Twitter employees,2022-11-07,public_relations,ev_all,EV
1713,1713,Musk's hyperloop begins full-scale testing,2022-11-07,public_relations,ev_all,EV
1714,1714,Musk says he has no choice but to lay off workers,2022-11-07,public_relations,ev_all,EV
1715,1715,Musk responded to the blue V payment system,2022-11-07,public_relations,ev_all,EV
1716,1716,Tesla shares fall back to a year and a half ago,2022-11-08,stock,ev_all,EV
1717,1717,Tesla offers further discounts after price cuts,2022-11-08,cost,ev_all,EV
1718,1718,Tesla makes 8 times more money selling a car than Toyota,2022-11-08,sales_marketing,ev_all,EV
1719,1719,Twitter user growth hits new high after Musk takes over,2022-11-08,public_relations,ev_all,EV
1720,1720,Twitter bans negative Tesla ads,2022-11-09,public_relations,ev_all,EV
1721,1721,Musk's Twitter will divide users into three categories,2022-11-09,public_relations,ev_all,EV
1722,1722,Musk's personal wealth fell by 1.2 trillion from a year ago,2022-11-09,public_relations,ev_all,EV
1723,1723,Tesla CEO Elon Musk sells Tesla stock,2022-11-09,public_relations,ev_all,EV
1724,1724,Volvo's pure electric flagship EX90 debuts,2022-11-10,technical_innovation,ev_all,EV
1725,1725,Musk wants to launch Yu'e Bao function on Twitter,2022-11-10,public_relations,ev_all,EV
1726,1726,NIO's net loss in the third quarter was 3.5 billion yuan,2022-11-11,cost,ev_all,EV
1727,1727,Musk says Twitter may go bankrupt,2022-11-11,public_relations,ev_all,EV
1728,1728,Musk sends first Twitter employee letter,2022-11-11,public_relations,ev_all,EV
1729,1729,Li Bin responds to the impact of Tesla's price cuts,2022-11-11,competition,ev_all,EV
1730,1730,Li Bin responds to the impact of Tesla's price cuts,2022-11-12,cost,ev_all,EV
1731,1731,NIO mobile phone released within one year,2022-11-13,technical_innovation,ev_all,EV
1732,1732,[Inventory of heavyweight new energy models - Li L9] Inventory of heavyweight new energy models - Li L9 new energy vehicles Li Auto L new energy vehicles Weibo video of Wenchexun​,2022-11-13,sales_marketing,ev_all,EV
1733,1733,Tesla Responds to Chaozhou Pedestrian Accident,2022-11-13,product,ev_all,EV
1734,1734,Witnesses recount the moment of the Tesla car accident in Chaozhou,2022-11-13,user_experience,ev_all,EV
1735,1735,2 dead and 3 injured in a Tesla out of control in Chaozhou,2022-11-13,product,ev_all,EV
1736,1736,Musk thanks Twitter employees for working late nights,2022-11-13,public_relations,ev_all,EV
1737,1737,"Xiaopeng also launched a price cut: From 14:00, Xiaopeng Motors will start a new price system for the New Year.",2022-11-13,cost,ev_all,EV
1738,1738,"Yundu Motors, once second only to NIO, is coming to an end. Yundu Automobile, which once achieved sales of 20,000 new energy vehicles in 2018, is becoming the first ""new power enterprise"" to be eliminated in 2022. At present, the entry of JuneYao Group is basically a foregone conclusion",2022-11-14,sales_marketing,ev_all,EV
1739,1739,Family members of Tesla's Chaozhou out-of-control accident respond via video,2022-11-14,public_relations,ev_all,EV
1740,1740,Musk claims to work 7 days a week,2022-11-14,public_relations,ev_all,EV
1741,1741,Musk abruptly fires 80% of Twitter contractors,2022-11-14,public_relations,ev_all,EV
1742,1742,Chaozhou Tesla driver speaks out,2022-11-14,public_relations,ev_all,EV
1743,1743,The driver's family refuted Tesla's response one by one,2022-11-14,public_relations,ev_all,EV
1744,1744,Tesla claims that Chaozhou car owners did not step on the brakes during the whole process,2022-11-14,public_relations,ev_all,EV
1745,1745,Tesla says police are seeking third-party identification,2022-11-14,public_relations,ev_all,EV
1746,1746,Men and women spend 148 yuan on the street to drive a BMW to escape orders,2022-11-15,cost,ev_all,EV
1747,1747,"How can the auto industry accelerate low-carbon transformation and promote the sustainable development of the industrial chain? Today, at the #Polestar# global core supplier forum held in Shanghai, 57 well-known suppliers in the industry discussed the realization path and innovative solutions of sustainable development.",2022-11-15,environment,ev_all,EV
1748,1748,Video released before Tesla accident in Chaozhou,2022-11-15,public_relations,ev_all,EV
1749,1749,Musk sleeps at Twitter headquarters,2022-11-15,public_relations,ev_all,EV
1750,1750,Tesla sells 530 yuan limited glass,2022-11-15,sales_marketing,ev_all,EV
1751,1751,Musk says Twitter will no longer display device models,2022-11-15,public_relations,ev_all,EV
1752,1752,Musk fires Twitter engineers who criticized him,2022-11-15,public_relations,ev_all,EV
1753,1753,Musk plans to cancel free lunch at Twitter HQ,2022-11-15,public_relations,ev_all,EV
1754,1754,"Kia's executives posted on Weibo that they tore BYD with their hands. The car circle is a bit like the digital circle. It is said that Kia does not seem to have any models in the new energy vehicle track in the past few years, and there is competition between the two",2022-11-17,competition,ev_all,EV
1755,1755,Musk warns Twitter employees not to work overtime or leave,2022-11-17,public_relations,ev_all,EV
1756,1756,Musk considers stepping down as Tesla CEO,2022-11-17,public_relations,ev_all,EV
1757,1757,Chaozhou Tesla accident car third-party appraisal site,2022-11-17,public_relations,ev_all,EV
1758,1758,Musk says population collapse is inevitable,2022-11-17,public_relations,ev_all,EV
1759,1759,Musk has identified a potential successor to Tesla CEO,2022-11-17,public_relations,ev_all,EV
1760,1760,Musk issues ultimatum to Twitter employees,2022-11-17,public_relations,ev_all,EV
1761,1761,Volkswagen's last gasoline-powered car is on the market,2022-11-18,sales_marketing,ev_all,EV
1762,1762,Musk changed his tune and said that Twitter employees can work remotely,2022-11-18,public_relations,ev_all,EV
1763,1763,"In 2022, BYD sales may surpass Volkswagen for the first time",2022-11-19,competition,ev_all,EV
1764,1764,BYD Huizhou factory catches fire,2022-11-19,product,ev_all,EV
1765,1765,Emergency management agency responds to fire at BYD Huizhou factory,2022-11-19,public_relations,ev_all,EV
1766,1766,Mass commerce performed relatively poorly,2022-11-20,sales_marketing,ev_all,EV
1767,1767,"BYD's price increase ranges from 2,000 to 6,000 yuan",2022-11-20,cost,ev_all,EV
1768,1768,Musk posted a photo of working overtime with Twitter employees in the early morning,2022-11-20,public_relations,ev_all,EV
1769,1769,Musk says he will unblock Trump's Twitter account,2022-11-20,public_relations,ev_all,EV
1770,1770,"Thanks to its pure electric platform, long wheelbase and large enough interior space, the FAW-Volkswagen model is a powerful masterpiece of a rare pure electric model with a large space. The 1D model uses a lot of the latest high-tech safety technologies of FAW-Volkswagen, such as lane change assistance, L2 level assisted driving and so on. Taking a comfortable 1D car, or traveling with the family, or gathering with friends, the car owners have more time to communicate and make their friendship, love, and family affection more intense.",2022-11-21,user_experience,ev_all,EV
1771,1771,"In 2022, BYD sales may surpass Volkswagen for the first time",2022-11-21,sales_marketing,ev_all,EV
1772,1772,The linkage between Volkswagen ID.4 and Ant-Man is indeed a bit dreamy. Maybe there will be ID. series in Ant-Man's next work. It is interesting to say that the real car can become so small!,2022-11-22,user_experience,ev_all,EV
1773,1773,"Tongda Power: No new changes have taken place in the cooperation between the company and BYD. Tongda Power issued a stock price change announcement in the evening, saying that from January to September, the company's total sales of new energy vehicle drive motor cores were 234 million yuan, accounting for 17.25% of the company's operating income. , of which BYD's revenue accounted for 7.75% of the company's operating income. The wheel hub motors currently rumored in the market are related to",2022-11-22,sales_marketing,ev_all,EV
1774,1774,Musk fears losing his position as world's richest man,2022-11-22,public_relations,ev_all,EV
1775,1775,Musk says Twitter layoffs are over,2022-11-22,public_relations,ev_all,EV
1776,1776,"Volkswagen ID. Space Vizzion concept car is expected to represent the future. Volkswagen ID. Space Vizzion concept car, the new car is a travel version of the car, unveiled at the Brussels Motor Show, in terms of shape is expected to represent the future design direction of Volkswagen, the new car It is also expected to be mass-produced, and it is still very worth looking forward to. The length, width and height are 4960/1900/1530mm respectively, and the wheelbase reaches 2970mm. The overall size of this body",2022-11-23,technical_innovation,ev_all,EV
1777,1777,"[Tesla and Huawei cut prices, how long can ""Wei XiaoLi "" last? 】""Wei XiaoLi "" decided not to lower the price. Recently, Li  Xiang, the founder of Li Auto, responded clearly in a Li ve broadcast that he would not follow Tesla to cut prices, and beLi eved that (these medium-sized SUVs should be set at the current price to be reasonable.” On the 1st, in the new energy vehicle country After the subsidy was officially cancelled, Xiaopeng Motors neither lowered nor raised its prices, and stated to the outside world that it will maintain the bottom Li ne. Expand the full text c",2022-11-23,cost,ev_all,EV
1778,1778,"Judging from the weekly data on the amount of insurance, it is clear that BYD is far ahead in the new energy vehicle industry, and there will be no players who can catch up in the short term. The scary thing is that the monthly sales of the Denza brand with an average sales price of 410,000 yuan will also exceed 10,000 vehicles. Considering the half-year delivery period of N7N8, Denza may sell more than 200,000 vehicles this year, but the valuation of Denza is included in the﻿002594 BYD﻿, according to Wei Xiaoli's valuation, this matter is not easy to handle​ Expand the full text c",2022-11-23,stock,ev_all,EV
1779,1779, The president of Volkswagen Germany said that China is a decisive market for the international auto industry #真是比通##新能源汽车##Germany Volkswagen# LSuperMaruko’s Weibo video​,2022-11-24,sales_marketing,ev_all,EV
1780,1780,"Published the headline article: ""Good-looking, easy-to-drive, and fun are only superficial, and it is still a safety benchmark for pure electric vehicles."" The new energy vehicle BYD O is good-looking, easy-to-drive, and fun.",2022-11-24,user_experience,ev_all,EV
1781,1781,Musk asks Twitter programmers to write weekly report,2022-11-24,public_relations,ev_all,EV
1782,1782,Musk complains about high fees for Apple and Google,2022-11-24,public_relations,ev_all,EV
1783,1783,Musk wants to unblock all banned Twitter accounts,2022-11-24,public_relations,ev_all,EV
1784,1784,"Xiaopeng Motors’ official announcement to adjust the price of domestic new energy vehicles has always followed Tesla’s tail and acted according to Tesla’s face. As soon as Tesla drops, domestic production will drop. Tesla is always the leader, and Xiaopeng and Weilai have to stand aside.​",2022-11-24,cost,ev_all,EV
1785,1785,"Danger! I bought a new energy vehicle for one year and the brakes failed. Mr. Zheng, a citizen of Zibo, said that he spent 240,000 on July 31 to buy a Volkswagen new energy vehicle. He did not expect that his brakes failed while driving recently, and he dealt with it urgently. Hit the curb. The special commissioner and Mr. Zheng came to the SAIC Volkswagen 4S store for negotiation. After the coordination of the special commissioner, the 4S shop agreed to replace the parts for free and give a compensation of 3 to 5,000 yuan​ Expand the full text c",2022-11-25,product,ev_all,EV
1786,1786,"Zhineng Tracking List 2nd Week (9th-15th) New Energy Vehicle TOP15 Tracking List 2nd Week @zhineng-yanyan NO 1 BYD Auto: 40,420 units, with a market share of 40.8%, ranking first. With the price cuts of Tesla, Wenjie and Xiaopeng, it will also have a great impact on the leading brothers. NO 2 Tesla China: 12,654 units. Tesla is taking the lead in raising prices and bargaining, which can drive the entire industry. Expand the full text c",2022-11-25,competition,ev_all,EV
1787,1787,Tesla responds to Model Y spontaneous combustion causing multiple luxury cars to be burned,2022-11-25,product,ev_all,EV
1788,1788,"Xiaopeng can’t sit still, and officially followed up the price reduction today. Some models of Xiaopeng P7 have different degrees of price reduction. The price of Xiaopeng P7 480G is reduced from the original 23.99w to 20.99w. The price of Xiaopeng P7 480E is reduced from the original 25.99w to 22.99w. The price of P7 586G has been reduced from 25.99w to 22.99w, and the price of Xiaopeng P7 625E has been reduced from 28.59w to 24.99w.",2022-11-25,cost,ev_all,EV
1789,1789,"Volkswagen recalls about 21,000 ID.4s in the US",2022-11-26,product,ev_all,EV
1790,1790,"[Tongda Power: There is no new change in the cooperation between the company and BYD] Tongda Power (002576) announcement: the company issued a stock price change announcement saying that from January to September, the company's total sales of new energy vehicle drive motor cores were 234 million yuan. Accounting for 17.25% of the company's operating income, of which BYD's revenue accounted for 7.75% of the company's operating income. At present, there are rumors in the market that the in-wheel motor has a production cooperation with the company, and the company won the bid for the ""Looking Up"" model, etc. Expand the full text c",2022-11-26,sales_marketing,ev_all,EV
1791,1791,Musk says he will make phones if Twitter is taken down,2022-11-26,public_relations,ev_all,EV
1792,1792,"SK On cooperated with Hyundai and Kia to build the EMP platform, and has done a lot of work in the technical improvement of the fast charging speed of the battery. SK On's current battery can reduce the charging time of an electric car to 18 minutes - the key to the technology is to inject lithium during charging to reduce the resistance of the anode",2022-11-27,product,ev_all,EV
1793,1793,"As of May 2018, a total of 15+1 new energy vehicle companies have been approved by the National Development and Reform Commission. Excluding the approval obtained by Changhe Suzuki related to the equity change of the joint venture, the remaining 15 companies, BAIC BJEV, got the first license in March 2016, and JAC Volkswagen got the last license in May 2017.",2022-11-27,user_experience,ev_all,EV
1794,1794,"The Spring Festival is getting closer and closer. Today’s sentiment is very good with yesterday’s. There is an upper shadow line and a lower shadow line. The transaction is 7072. In terms of the direction of the sector, the concept of the chip is affected by the news today and it has risen. The nine companies have a daily limit, and there will be no continuity. Military industry, six companies with daily limit, six companies with BYD concept daily limit, the direction of individual stocks, hot money these days, institutions are very optimistic about the direction of new energy vehicles, whether it is betting on quarterly reports or",2022-11-27,macroeconomics,ev_all,EV
1795,1795,"The new king ascended the throne, BYD sold 18.6 million ➕, and sold 235,000 in December, surpassing the North and South Volkswagen to become the sales champion for 22 years #贝迪##新能源汽车#​​",2022-11-28,competition,ev_all,EV
1796,1796,"An old ""news"" from BYD's new energy vehicle Wang Chuanfu - Wang Chuanfu said that the world's number one in 2025, the secret weapon is new energy vehicles​",2022-11-28,public_relations,ev_all,EV
1797,1797,Musk invites Bill Gates to drive Tesla Semi,2022-11-28,public_relations,ev_all,EV
1798,1798,Musk Exposes Twitter 2.0,2022-11-28,public_relations,ev_all,EV
1799,1799,"Some time ago, BYD unveiled a model that has aroused heated discussions - looking up to the U8. The in-situ steering and four-wheel drive functions have also caused controversy, but behind these functions is BYD's black technology ""Easy Square"". Today, let's take a deep look at BYD's ""Easy Sifang"" four-motor drive technology to see if it's really so awesome? Weibo video of BYD's new energy vehicle L electric Zhishi operation girl​",2022-11-29,product,ev_all,EV
1800,1800,Musk Says Apple Threatens to Remove Twitter,2022-11-29,public_relations,ev_all,EV
1801,1801,"After Shanghai 2005, it is meaningless to talk to Musk",2022-11-29,public_relations,ev_all,EV
1802,1802,Taizhou traffic police report Tesla rear-end collision caused 2 deaths and 1 injury,2022-11-29,product,ev_all,EV
1803,1803,"Weimar Motors directly-operated stores and dealers closed a large number of new energy vehicles and began to lose money. Wei XiaoLi  has been losing money. Tesla also needs to cut prices to cater to the market. It is difficult for second- and third-tier echelons Li ke Weimar Yes, if the Xiaomi car goes well, it will overwhelm a group after it goes on the market, just wait and see.​",2022-11-30,cost,ev_all,EV
1804,1804,"The price of BYD D1 increased by 3,000 yuan [Original Citation] Sina Report: BYD D1 is positioned as a compact MPV. It first appeared as a commercial vehicle and was launched for consumers at the end of last year. The price of BYD D1 has been adjusted, and the guide price of the standard version is 160,800 yuan, an increase of 3,000 yuan. Big v chat car new energy vehicles​",2022-11-30,cost,ev_all,EV
1805,1805,Relatives and friends of Tesla accident owner in Taizhou responded,2022-11-30,user_experience,ev_all,EV
1806,1806,"PubLi shed a headLi ne article: ""Tesla and Huawei cut prices, how long can ""Wei XiaoLi "" last?"" """"Wei XiaoLi "" decided not to lower the price. Recently, Li  Xiang, the founder of Li Auto, responded clearly in a Li ve broadcast that he would not follow Tesla to cut prices, and beLi eved that (these medium-sized SUVs should be set at the current price to be reasonable.” On the 1st, in the new energy vehicle country After the subsidy was officially cancelled, Xiaopeng Motors neither lowered nor raised its prices, and announced that it will continue to expand the full text c",2022-12-01,competition,ev_all,EV
1807,1807,"[Tongda Power: No new changes have taken place in the cooperation between the company and BYD] Financial Associated News Agency, Tongda Power announced the announcement of stock price changes. From January to September, the company’s total sales of new energy vehicle drive motor cores were 234.23 million yuan. It accounts for 17.25% of the company's operating income, of which BYD's revenue accounts for 7.75% of the company's operating income. Currently, the market rumors that the in-wheel motor has a production cooperation with the company, and the company won the bid for the ""Looking Up"" car​ Expand the full text c",2022-12-01,sales_marketing,ev_all,EV
